{
  "protocol_version": 2,
  "scope": "session",
  "session_id": "sess-design-01",
  "seq": 18,
  "revision": 42,
  "generation_id": "gen-20260724-0007",
  "request_id": "req-01J3M6N9",
  "kind": "message.delta",
  "occurred_at": "2026-07-24T09:31:12Z",
  "payload": {
    "message_id": "msg-104",
    "delta": "Generation committed."
  }
}
